ID,Sentence,Words
60318,"حتى إنه يوجد على الملابس الداخلية النسائية. ولكن مركزا في عبارة: ""ماذا عن أبدًا .. هل أبدًا يناسبك؟""",18
90788,ويمكن ان تروا هنا الاخشاب المقطعة .. والتي قمت بتحضيرها ..,11
11648,لماذا لا نكون كفريق واحد؟ لماذا لا نقيم هدنة في الحياة؟,11
104264,فهل حقا يمكننا ان نصنع قائمة طعام لذيذ من دون كبد الأوز,12
122503,تعلمت ايضاً كيف أن معظم أشكال الطاقة التي لا يمكن السيطرة عليها يمكن تسخيرها للخير وجعل المجتمع أفضل .,19
164955,"أول شئ رأيته كان شمال أمريكا في الليل -- متوهجة ، كلها متوهجة. مشاعر دافئة. ضوء.",16
1715,"إدا طلبتم من أصدقائي و عائلتي أن يصفوني، فذلك ما سيقولونه لكم.",12
137018,وأفضل نظام يمكن تصميمه من أجل هذا الغرض هو نظام حيث يصنع بضعة أشخاص قراراتهم اليومية باسم الكثير من الناس,20
165149,وإذا كنت تملك حبة لقاح فإنه نظريا يمكنك تبين المكان الذي جاءت منه,13
53202,"جميل جدا إلى درجة أنني سأتخلى عن ضحكة لأشرح مدى حبي لهذا الكوكب بذاته، ويوم السبت، سمي بسببه، بروعة.",19
162350,"أخذ منى الأمر عدة سنوات لكن بمساعدة عائلتى التى دعمتنى بشكل مذهل، قررت أخيرًا أن الحياة لا تزال جديرة بالعيش.",20
157983,"هذا يعد اكبر مشروع علمي ممول من الجموع الذي نعلم عنه اكثر من 8,000 شخص حتى الان سجلوا للمشاركة .",20
112178,وأدركت أنني اكتشفت أمراً ما والذي يمتلك امكانية كبيرة لتغيير العالم.,11
117441,"فحين يكون هناك عرس في الحي، كنا نطلي منازلنا من أجل العرس..",12
166336,"لقد بدأت بهذه الجملة قبل حوالي 12 عاما، وبدأت في سياق بلدان نامية، ولكنّكم اليوم هنا من كلّ أنحاء العالم.",20
146712,"وواحدة من التطبيقات التي كنت اعمل عليها والتي جذبت اهتمام العالم أجمع هي العمل على تشريح "" إفتراضي "" للجسم",20
140152,"نحن لا نحاول أن نبدأ تمويلا, لكن نريد شخصا آخر أن يفعل هذا.",13
201733,كريس: ربما يحتاج الأمر إلى شخص ما تستثيره الأرقام والرسومات البيانية عوضا عن ذلك الوجه الكبير الحزين ليتم استقطابه.,19
199910,مايكل تيلسون توماس: ألحن هو أم إيقاع أم مزاج أم سلوك؟,11
155261,"وفي القرية أيضا، هناك رئيس واحد، الأكبر، الذي إذا قال نعم، الجميع سوف يرضخ.",14
167777,"اعتقد، انه خلال استمتاعي بحياتي كعازفة سعيده، اني اكسب تقدير اكثر بكثير مما حلمت به يوماً.",16
51286,"تمت تقوية القاعدة من خلال القوة الاجتماعية للتشارك وهي تهدد النماذج القديمة، النماذج التناظرية القديمة للتحكم والسيطرة.",17
39001,"وأيضا, أول مرة أتذوق فيها طعم التنميط الثقافي كانت هناك.",10
194430,"حسنا، للإجابة لهذا السؤال، دعونا نشاهد الشكل الذي اتخذته المعلومات، ظاهرياً في الماضي.",13
48027,"و ثانياً ، لابد أن تكون بسعر معقول أكثر من سيارات اليوم .",13
20780,"نحن مهوسو حمض نووي والحمض النووي هو الأرخص, والأسهل في الفهم و الأسهل للاستخدام لبرمجة المواد لفعل هذا",18
